date,name,description,random_sum,random_average,random_decimals
2024-10-08,Vjabwgp Cyukcjhr,zeta alpha sigma alpha gamma alpha beta theta delta zeta gamma zeta,7912,377.99,0.965635
2025-05-20,Xhjkgi Zxsvq,sigma delta theta gamma beta beta sigma sigma lambda omega zeta,7614,721.16,0.037545
2024-09-04,Xbdfmua Jeqfljgs,theta gamma theta delta alpha omega omega delta alpha sigma gamma,5699,561.34,0.739207
2021-01-24,Hnmuk Hvuhq,beta sigma zeta theta gamma alpha gamma lambda omega,8361,48.43,0.902632
2023-08-16,Injtiprp Qbogku,omega sigma zeta alpha gamma gamma omega delta zeta delta lambda,2523,999.58,0.376535
2023-07-07,Roxw Dfvtbq,sigma gamma zeta omega alpha,1691,660.16,0.127034
2024-07-08,Qbedxwwk Ljigzvdyp,theta gamma beta sigma sigma theta beta lambda,4966,443.07,0.24385
2024-05-12,Mxuy Rfgdnwae,theta sigma omega omega theta theta,9782,607.61,0.103775
2020-10-22,Psockmzm Sowut,lambda sigma alpha zeta theta sigma theta delta zeta lambda delta sigma,5802,312.37,0.369041
2021-07-23,Uayrkh Uwkjmqze,theta gamma beta gamma theta alpha beta,8714,40.18,0.022335
2022-05-24,Wfklg Oztna,gamma beta zeta beta gamma zeta gamma lambda zeta omega theta theta,406,563.2,0.837224
2024-06-21,Liycntf Ezgggdzgf,delta delta sigma zeta sigma gamma beta omega beta beta delta sigma,5344,183.62,0.313752
2024-09-21,Nudlsi Zgetqtud,alpha gamma omega lambda theta alpha gamma lambda gamma lambda alpha sigma,9894,487.73,0.330433
2021-08-29,Ynfwirgt Dphvz,omega gamma sigma zeta beta zeta lambda omega alpha,5541,927.69,0.842759
2023-11-16,Obofknh Iuqokz,omega omega sigma zeta delta alpha beta beta zeta sigma sigma sigma,4212,451.61,0.416338
2023-08-03,Gmjhariu Qhmibdi,omega theta zeta delta theta alpha,4855,586.28,0.144943
2024-08-01,Jmsj Uokvriyi,gamma sigma gamma delta sigma alpha lambda sigma theta sigma sigma delta,519,436.22,0.974409
2023-09-08,Pshowpq Hxxgw,delta gamma gamma beta sigma lambda lambda alpha zeta,4121,804.87,0.930802
2024-02-20,Cfoa Qhkqvz,alpha zeta gamma gamma beta omega delta theta omega zeta delta,900,373.42,0.097517
2021-09-08,Wlkl Eibqyg,delta omega delta alpha alpha delta beta theta omega theta delta,5892,601.89,0.952806
2021-07-03,Hezwp Uiyun,omega beta omega sigma sigma delta lambda lambda theta gamma alpha delta,2800,859.3,0.644672
2024-07-13,Jafjksz Mumxfc,lambda zeta gamma alpha theta theta sigma omega,9225,978.95,0.063983
2021-04-01,Epzpbl Meodepa,zeta alpha sigma theta omega delta beta delta beta,5010,736.69,0.137277
2024-12-05,Xqvc Yjuykfohw,sigma gamma omega theta theta delta alpha delta theta gamma,928,866.79,0.717639
2023-12-20,Dmuro Sqmfbl,beta theta zeta omega sigma,6496,638.59,0.460385
2024-02-01,Ablaagy Ugszvt,theta sigma omega gamma theta beta alpha theta beta zeta delta,9839,156.47,0.071415
2023-09-20,Dxsg Yiwbj,beta alpha theta theta delta,793,722.1,0.047653
2024-12-08,Fbixaa Meqteqh,beta theta zeta delta beta sigma omega omega alpha lambda lambda,8374,376.45,0.675563
2025-06-02,Aqob Chqwzmuim,sigma lambda lambda lambda lambda sigma gamma omega delta delta delta zeta,4049,738.69,0.036415
2025-04-20,Fkaqafxd Yeeea,beta zeta theta beta gamma lambda zeta,8653,512.17,0.599489
2021-04-17,Dpzqhhxo Zrsym,theta gamma sigma delta delta lambda omega,7890,415.54,0.603794
2024-05-15,Kwzwwke Tlxwh,theta theta alpha theta sigma gamma beta lambda,7846,812.53,0.398391
2022-06-19,Jdicv Jcput,gamma theta zeta theta gamma sigma lambda,7967,695.75,0.499444
2023-02-20,Jkxwzl Muwvugs,lambda beta gamma omega beta lambda theta zeta,2679,192.88,0.384107
2024-05-04,Kgipdqmm Ntihpgbq,beta gamma lambda gamma delta lambda zeta lambda sigma,6751,172.66,0.935158
2023-05-01,Tvnux Bweyvkxtc,lambda lambda sigma delta alpha beta theta sigma theta beta,3596,853.35,0.676572
2025-07-14,Rdvfwl Lqvftls,gamma theta lambda beta beta omega,2074,735.54,0.832981
2022-04-10,Ibdx Cttolsz,alpha alpha beta theta alpha beta delta,3884,112.18,0.234319
2025-08-30,Rnjgjfkg Ebvozhc,beta sigma alpha lambda lambda theta,5154,33.38,0.356344
2024-09-19,Seogt Vrpzmp,omega zeta theta theta omega beta sigma lambda zeta sigma gamma,9820,987.98,0.193674
2020-10-13,Cxecwtuc Serozkvna,omega alpha beta sigma gamma zeta lambda,7779,844.26,0.189548
2022-07-08,Wkjhqfbk Rpjeji,beta sigma sigma omega gamma sigma alpha omega beta delta,2843,187.22,0.064847
2021-11-06,Gkvenu Xkmgaz,gamma sigma theta delta theta lambda omega zeta omega omega,553,178.74,0.420698
2025-09-28,Piptqd Ruldl,alpha lambda omega sigma delta lambda delta gamma,8250,726.86,0.16278
2021-06-07,Qqnq Prjcho,omega theta zeta zeta alpha beta lambda omega lambda omega,5688,503.92,0.146542
2021-08-29,Dulluoqi Pprabg,lambda lambda delta gamma zeta omega gamma zeta theta alpha,5456,106.65,0.058304
2024-09-02,Mekssrt Nqhqhjj,sigma omega zeta zeta zeta theta beta,3468,112.16,0.596254
2021-03-31,Czcbcbo Kvoryhnpb,sigma omega alpha beta sigma theta delta alpha alpha zeta,732,907.76,0.223284
2021-08-08,Zbagzakm Jucbt,sigma theta gamma zeta lambda zeta omega sigma sigma,233,421.54,0.826198
2025-07-05,Vukya Fmcrvpjl,sigma lambda zeta zeta gamma gamma beta zeta lambda delta delta,4834,293.06,0.625171
2021-01-12,Tezfqp Rddwo,gamma beta alpha alpha sigma gamma gamma theta,8296,603.75,0.623917
2022-10-01,Gvgy Ejvyl,theta alpha alpha omega delta omega beta alpha lambda beta zeta,2004,286.01,0.959886
2025-02-23,Kpclg Bavnnfviv,zeta gamma theta gamma beta omega,9554,653.86,0.868248
2021-03-18,Cquri Gmxzu,omega lambda omega delta lambda theta beta,3295,85.0,0.250955
2024-12-04,Ignl Nokbtss,lambda theta sigma sigma delta alpha delta delta theta lambda omega,6087,440.85,0.766125
2023-11-05,Rewnb Nihqkmf,sigma theta lambda delta delta beta lambda,4266,955.87,0.2854
2025-06-29,Qvkwnw Ecxkgp,lambda zeta beta sigma omega,8905,927.28,0.429868
2025-07-31,Zxykth Xbzttv,lambda lambda beta omega beta,917,852.54,0.030952
2025-02-19,Viqrtmzz Tauhbsllq,omega theta alpha delta beta zeta delta lambda delta lambda zeta omega,7038,304.01,0.760224
2025-04-18,Xybledcv Vaczuzrn,delta beta zeta lambda alpha zeta zeta beta beta delta,5585,782.7,0.765534
2022-04-24,Csdchhl Ypape,gamma theta lambda gamma theta omega gamma sigma zeta theta delta,7250,882.7,0.299663
2024-06-03,Swsxyo Inrhyao,theta zeta zeta alpha sigma alpha gamma,6475,85.14,0.138302
2024-02-10,Gsigi Mobreo,gamma beta delta gamma zeta lambda gamma theta,2160,60.53,0.453386
2025-03-30,Ibbu Dlskelmc,sigma beta alpha delta beta beta,9556,393.58,0.156744
2022-05-28,Viblbhd Cakufa,lambda beta delta delta sigma theta alpha gamma,8090,880.26,0.478374
2022-03-03,Kqallz Ngdpypefs,theta lambda theta alpha gamma zeta delta omega delta delta,5975,389.13,0.815734
2024-06-04,Pnbdol Xtctwu,alpha sigma sigma omega zeta theta omega delta,9280,889.39,0.1145
2022-02-11,Jzyjrmf Adcebhgvg,sigma gamma omega omega beta delta sigma gamma theta theta,5730,721.34,0.751635
2022-03-24,Jucrvzkt Dzhuszm,sigma omega omega omega sigma lambda omega,8263,577.19,0.705374
2023-02-03,Kzph Jjtvu,alpha theta lambda omega beta delta theta lambda theta alpha omega theta,4270,872.55,0.739345
2021-05-10,Njpxysh Ikwrvo,delta zeta lambda zeta lambda lambda omega alpha sigma alpha,6777,250.01,0.75591
2025-06-17,Vgnbmaz Iquvogof,theta beta zeta sigma zeta,4675,582.59,0.403195
2021-02-01,Rvnu Gxcrw,gamma alpha beta alpha alpha,294,940.03,0.662766
2021-01-13,Omvggbz Gpmkwj,lambda alpha gamma delta alpha omega zeta zeta zeta alpha alpha beta,595,930.29,0.55127
2021-04-24,Hdbdoyf Chbutp,delta theta lambda alpha sigma delta omega omega,4179,226.19,0.188843
2021-06-21,Swnxo Qdcao,gamma gamma theta beta delta lambda alpha,8168,61.61,0.609456
2025-03-24,Iouxm Epdqk,zeta zeta zeta gamma sigma theta,1022,484.29,0.885158
2021-02-10,Isurgl Idvhsgldp,delta delta omega theta delta delta,4853,298.32,0.913711
2021-09-20,Hvcnokk Ncfacatt,gamma sigma beta gamma alpha omega lambda sigma theta omega delta,1232,600.82,0.993348
2023-08-10,Yelka Bwvqpvj,beta gamma lambda zeta beta alpha alpha theta delta delta omega delta,9784,763.25,0.15914
2024-04-22,Dlxymbi Stdgk,alpha zeta alpha lambda zeta zeta gamma zeta theta,5601,431.01,0.885006
2024-10-21,Zjyxatjw Ncfoe,gamma omega zeta zeta sigma sigma theta beta alpha,8165,417.82,0.563989
2022-02-25,Fcmbzo Hvwhi,omega beta gamma sigma beta beta,3444,104.74,0.412487
2024-05-16,Xewoexuf Fwhcwsk,beta lambda alpha sigma beta zeta zeta delta zeta sigma theta omega,4525,110.37,0.546155
2021-05-22,Viksug Xbaix,omega sigma omega lambda zeta gamma beta gamma delta sigma omega theta,2279,823.46,0.593521
2021-06-15,Quon Koxtvs,lambda alpha alpha lambda gamma alpha alpha sigma sigma delta theta,8029,190.66,0.865884
2023-05-13,Nawyzf Ceexmdly,lambda delta lambda alpha sigma theta,5446,401.41,0.53379
2021-10-11,Akvrwkg Wpsmxo,delta gamma theta gamma lambda theta,7421,978.49,0.716416
2024-03-12,Ycmxblw Fblozmh,theta omega alpha alpha lambda alpha beta sigma lambda delta,3848,24.19,0.612243
2024-07-14,Vrnf Wbfbyjf,lambda omega zeta sigma delta lambda,6498,139.04,0.792946
2025-05-04,Amanvlag Zfwqwo,gamma lambda theta gamma zeta gamma omega theta lambda beta lambda theta,1896,876.53,0.10507
2024-05-15,Wagr Srzqa,gamma sigma lambda sigma beta alpha theta beta lambda omega,5061,332.81,0.987946
2022-06-08,Pzeja Cczctbzfc,zeta sigma beta gamma zeta alpha theta sigma sigma theta zeta,8241,244.62,0.749602
2021-02-08,Nssmfsr Ckvvpdsu,sigma zeta beta gamma theta omega gamma,8992,560.54,0.896775
2024-07-30,Lznfkqbj Iidkmepmx,omega omega delta delta theta,206,469.37,0.687487
2021-02-27,Rmegzdh Dgdmk,gamma delta alpha omega sigma,4389,63.43,0.12826
2023-06-07,Ngej Pvlinhz,lambda alpha sigma beta theta gamma lambda delta sigma lambda,5381,742.05,0.736364
2024-08-08,Utmr Rohsip,gamma sigma omega delta delta gamma omega gamma zeta beta gamma zeta,7868,584.5,0.959337
2025-07-10,Vpzl Tafsegpl,theta alpha theta alpha omega beta gamma sigma theta omega gamma sigma,5347,696.63,0.597159
2022-04-03,Vqhwxw Ujjiwx,alpha gamma delta sigma theta,308,218.41,0.999834
2020-10-14,Ureu Cizrbo,theta beta omega delta alpha sigma theta sigma lambda lambda alpha,4126,18.84,0.589878
2021-06-14,Qyshwgyb Vurgo,lambda sigma beta gamma omega beta theta beta lambda,2144,948.04,0.368616
2022-09-23,Eqcjul Pgxnptyf,omega sigma sigma alpha sigma beta delta zeta gamma,8928,462.89,0.041314
2020-12-21,Awzb Vlynfqvq,zeta lambda delta zeta theta theta gamma,5475,797.16,0.810504
2025-07-04,Slwj Vxyggbral,gamma omega gamma sigma zeta alpha lambda beta zeta omega,9834,231.54,0.753719
2024-02-03,Snhv Acpwgy,theta omega delta zeta delta lambda gamma alpha sigma,7892,654.8,0.611864
2025-03-10,Myhpgeub Snffpj,beta omega lambda alpha sigma omega zeta omega delta lambda,5833,176.51,0.455156
2024-01-01,Odlh Fsnwxlhfp,beta gamma beta zeta gamma gamma zeta omega,4643,682.31,0.891488
2023-07-31,Hhfqku Dloetk,beta sigma gamma theta theta lambda lambda theta sigma beta omega zeta,6261,534.94,0.380959
2024-01-26,Iueoh Wnaxc,delta theta omega sigma lambda gamma alpha beta,655,750.12,0.506275
2025-05-25,Oynojyo Jaeyrn,beta sigma omega delta delta zeta,6275,98.15,0.627239
2025-03-13,Cshoghnw Tqbnmu,beta beta sigma gamma theta theta,2028,514.23,0.423063
2025-01-25,Cqtcoqah Eebqzfzl,lambda omega zeta sigma delta omega gamma omega,6816,990.87,0.66505
2023-01-04,Icthzwgz Alcek,theta beta zeta omega sigma alpha,1335,159.93,0.83932
2024-11-02,Vssgoq Sfegrkme,omega zeta theta omega delta sigma delta delta zeta delta lambda theta,9228,898.65,0.150054
2021-07-22,Jagrkxz Ptyils,delta beta zeta gamma gamma,6904,45.52,0.423481
2024-02-14,Nbiq Sdxjpkab,sigma delta zeta sigma theta delta alpha beta sigma beta,7627,306.53,0.018893
2025-07-08,Pkixp Kpuizk,sigma omega zeta delta omega delta sigma lambda beta beta theta beta,1894,152.06,0.082601
2025-03-20,Eyutxbnh Zhgqoyb,gamma beta gamma delta zeta alpha alpha delta sigma lambda gamma delta,1063,600.52,0.082964
2023-06-28,Grgqdgk Fumhqadp,omega beta zeta theta gamma gamma alpha sigma lambda alpha,7654,344.27,0.597861
2024-09-16,Buht Bkzuzrzsb,lambda zeta theta beta delta sigma gamma,7475,606.83,0.307419
2021-12-28,Zeusrxvs Xzujw,beta omega theta zeta delta gamma,6203,945.43,0.043506
2021-11-05,Ecki Ghtwiw,beta omega beta beta alpha zeta omega alpha,3709,145.42,0.649779
2025-05-13,Vfqotk Mfccje,delta beta gamma sigma gamma sigma sigma omega beta,3232,185.01,0.056778
2024-02-27,Peemwyme Htlaybwd,lambda omega omega sigma zeta theta beta gamma alpha beta alpha theta,7046,461.42,0.449839
2023-01-29,Fgyadssa Cepbth,theta beta sigma beta beta delta delta sigma omega theta theta theta,1274,255.77,0.053149
2023-02-15,Qvtrtmk Ldqsqzfyx,zeta zeta zeta theta omega beta lambda zeta sigma alpha beta,4804,537.44,0.583359
2023-02-04,Ujqdzwlo Rugwkv,zeta lambda gamma delta omega gamma,5817,295.79,0.201789
2024-06-24,Xuojzeip Nfzsgu,gamma beta theta beta lambda lambda omega alpha theta,8674,817.83,0.390988
2024-05-14,Hlhppztv Iqszrky,lambda beta alpha sigma lambda theta,6424,913.0,0.994264
2024-05-11,Cirhapm Wbvqq,gamma zeta zeta alpha zeta omega lambda theta zeta alpha alpha lambda,7742,498.5,0.668125
2025-04-18,Luddltv Vmqzmjds,theta zeta zeta omega beta zeta,4689,393.7,0.365014
2022-06-13,Ejyw Lcblqya,theta alpha delta beta delta gamma omega gamma beta delta alpha beta,700,592.97,0.300294
2025-03-27,Oikgj Dhkskm,omega gamma alpha alpha delta gamma alpha,273,794.02,0.620379
2022-08-05,Sgbzh Jhxdnp,gamma beta sigma sigma omega sigma sigma zeta alpha theta,3773,457.33,0.85776
2024-08-17,Cibcgbeq Uayuc,lambda theta beta omega alpha gamma,3741,332.91,0.903671
2023-06-14,Lqrwfdt Fioaho,lambda beta theta sigma lambda lambda,9436,421.33,0.911499
2022-10-15,Xbucmotf Sbeuuefp,sigma alpha alpha lambda theta lambda gamma sigma delta,7894,588.78,0.249872
2021-03-18,Ldzdwvqt Hsfopq,sigma delta gamma omega delta sigma beta,2054,531.6,0.547444
2025-02-12,Pfwjvfmj Vsmbyhg,beta alpha omega theta gamma zeta gamma beta beta,6256,166.32,0.560428
2021-10-12,Hrbq Tlxxhqzh,beta alpha zeta gamma alpha delta lambda lambda sigma lambda,6140,301.85,0.589725
2024-06-21,Fnbui Mzoaktrjb,alpha theta alpha beta delta zeta theta omega zeta,1322,112.21,0.469041
2024-02-12,Uflrnrpv Azwdodrr,beta gamma beta theta lambda delta sigma delta sigma lambda,373,751.86,0.152681
2023-04-03,Rgoseu Eklmrw,omega zeta gamma omega lambda,4124,171.81,0.551181
2024-04-20,Rcuwek Maswic,omega delta zeta sigma delta gamma,9073,148.27,0.486985
2021-05-18,Fldj Ixamu,lambda sigma theta lambda gamma lambda gamma gamma theta sigma alpha,6351,82.37,0.94498
2022-06-23,Ctaj Ohmibcv,lambda lambda theta beta sigma beta delta,5311,359.13,0.681223
2024-05-23,Zdrgfxny Irbdbiyf,gamma alpha omega zeta omega zeta,8312,931.34,0.316433
2022-05-15,Ripdslm Uegksde,theta sigma zeta zeta zeta,3806,647.26,0.577459
2025-05-26,Antj Paauxp,alpha sigma gamma lambda alpha zeta lambda alpha theta theta,8716,437.68,0.616676
2025-01-28,Uzwa Lzhdgaqc,omega alpha sigma zeta zeta zeta,4796,37.43,0.281338
2022-02-22,Mrapb Edckdltm,alpha delta alpha beta omega beta lambda,522,152.72,0.185578
2023-11-16,Kqnjfp Vilwk,theta sigma theta alpha beta,7224,297.76,0.464922
2023-05-29,Dzesiay Kzssyz,lambda alpha gamma alpha beta zeta lambda lambda,242,878.66,0.845266
2023-10-27,Sxhg Bqvrs,delta sigma omega sigma alpha delta beta sigma beta,7424,323.37,0.577084
2022-05-24,Zhfr Dwwqdzz,lambda beta gamma alpha lambda beta,863,746.65,0.035337
2024-01-02,Xmrhg Eingm,delta beta lambda delta zeta lambda lambda zeta,8621,564.78,0.94455
2021-03-06,Dpuklop Fbjoe,sigma zeta omega lambda lambda alpha gamma gamma zeta,6337,585.83,0.589521
2023-08-11,Ayoiu Iqbhg,delta beta gamma gamma sigma zeta alpha beta lambda zeta sigma sigma,4613,36.88,0.339344
2024-09-24,Lubduufn Hoopegsz,sigma theta delta gamma alpha beta gamma gamma gamma theta lambda,2614,731.75,0.906606
2023-08-15,Xmthqs Hhcvtu,zeta delta lambda alpha theta beta,9126,247.07,0.642949
2020-11-10,Vulqaadt Dtgfyqo,alpha sigma lambda zeta delta theta,407,707.62,0.97579
2024-03-01,Rukbcnn Twsmu,delta omega omega delta omega delta delta alpha,3117,715.44,0.097546
2022-08-26,Lseao Vcnsovu,omega alpha lambda sigma theta omega alpha omega alpha beta,7981,747.74,0.696961
2024-10-25,Zkrghrub Oeutcdmjb,omega gamma alpha zeta omega,6511,973.22,0.281533
2020-12-12,Jjkq Jeezk,zeta lambda beta lambda zeta alpha lambda theta,5751,320.34,0.110866
2024-08-03,Evzavkp Wiftlf,zeta theta gamma lambda sigma lambda,2746,469.98,0.810191
2021-02-10,Mykfekg Lzfmxpp,sigma lambda theta theta gamma theta alpha zeta gamma beta lambda theta,2625,767.64,0.251532
2020-11-30,Tgyxiqtu Hwohm,beta omega theta delta zeta zeta zeta alpha gamma theta theta delta,2416,52.81,0.156468
2022-02-20,Pitbpr Dolpqdakw,theta omega zeta gamma alpha omega omega theta delta beta beta,1881,901.49,0.858804
2024-09-02,Hehmkufc Lcgqh,gamma omega omega zeta delta,1356,951.7,0.583494
2021-01-07,Hlwmsoi Seadhsch,omega zeta beta delta lambda lambda,4230,378.9,0.468311
2022-04-01,Jmqm Iczxo,lambda gamma sigma gamma beta omega zeta beta zeta lambda alpha,6002,272.7,0.770753
2025-08-09,Jwrdxd Gdlvuyhuc,lambda zeta theta gamma sigma beta sigma,7352,51.17,0.446262
2021-10-03,Ctvzabh Fhqmk,beta lambda zeta theta gamma gamma lambda zeta delta alpha alpha,9208,288.01,0.806473
2024-04-16,Hhklo Naooogse,sigma omega omega beta omega delta delta theta lambda theta theta zeta,9483,694.63,0.742006
2024-06-02,Vhms Pqdcldza,delta sigma omega theta zeta theta sigma lambda gamma omega sigma,4477,467.0,0.100228
2025-08-06,Ohhtzwn Ntpldnjls,omega delta beta delta sigma theta sigma,5468,795.86,0.483421
2023-11-07,Wogzxm Wlirrgo,alpha delta beta gamma beta delta omega delta theta gamma,7051,823.25,0.082293
2025-10-05,Ftfptc Mubvpo,delta beta sigma alpha zeta sigma omega gamma sigma delta beta,7496,935.08,0.278404
2024-06-29,Sffdpvhy Nvcha,omega alpha sigma gamma alpha theta gamma theta lambda omega gamma zeta,5251,303.89,0.518118
2020-11-13,Snaqia Zxjhhx,gamma delta gamma zeta theta,7259,270.03,0.177836
2024-12-11,Wyaya Atsvwh,beta lambda delta theta beta alpha alpha sigma theta,2218,423.92,0.378002
2023-09-29,Rrmvtiug Sdzte,beta alpha gamma alpha delta delta,4418,229.08,0.058796
2023-04-24,Tditpvu Ernkmxao,alpha omega gamma delta zeta lambda gamma gamma gamma beta gamma lambda,289,860.82,0.912986
2022-07-28,Pogro Acszyq,alpha sigma beta lambda alpha omega omega omega lambda zeta alpha delta,1106,412.49,0.754849
2024-09-18,Fmzbmnvm Libbi,omega zeta beta theta delta lambda gamma zeta gamma theta,4227,803.63,0.520254
2021-04-14,Xqjnvz Rcawta,zeta gamma gamma alpha gamma omega omega zeta alpha,6438,619.33,0.597404
2021-08-15,Usoguj Lqackipcv,gamma zeta theta theta lambda lambda lambda beta omega,3458,94.23,0.354229
2023-05-16,Vsxeemm Pzgknrw,omega beta beta sigma zeta sigma gamma zeta,459,372.23,0.111156
2021-06-21,Qlyaoe Zcslc,sigma omega sigma theta lambda sigma,5143,854.46,0.420427
2021-03-31,Flazxvkt Iszeyxmt,delta zeta delta theta zeta,2632,836.67,0.107263
2023-03-09,Rxzss Xvqtx,sigma zeta omega beta alpha sigma zeta sigma beta omega,6577,429.42,0.255134
2021-01-17,Ckekh Qxdkm,delta theta gamma sigma beta sigma sigma lambda zeta,2162,860.05,0.263867
2024-02-11,Evnbat Ohxpok,zeta theta lambda beta alpha beta lambda omega beta,1544,207.69,0.009625
2021-07-06,Ylrxwk Hzsfx,theta delta theta alpha alpha sigma lambda theta gamma,5548,151.56,0.65187
2024-05-21,Ixdciubl Pnsyzpq,sigma gamma omega delta gamma zeta alpha lambda,7170,188.78,0.283235
2024-11-24,Efkl Elkza,beta zeta gamma sigma sigma alpha lambda lambda zeta theta,8980,198.71,0.613417
2022-08-20,Qiavunkv Hyimmmu,gamma lambda zeta beta zeta,3315,624.13,0.773639
2023-02-16,Wekrxv Licld,delta sigma alpha sigma gamma gamma gamma omega,6657,553.61,0.212232
2021-08-15,Qyhu Cptgmzh,beta delta gamma sigma theta lambda,3592,511.79,0.829423
2020-10-13,Sdeoi Bepsv,zeta lambda sigma lambda delta sigma beta sigma theta,5765,742.26,0.230244
2023-03-23,Epofojk Tepurycc,theta omega delta omega theta alpha,6160,440.3,0.713481
2023-02-27,Vevyx Pznuiwxv,zeta gamma zeta gamma alpha gamma delta omega alpha alpha gamma zeta,4648,985.94,0.655048
2022-03-05,Xzrofjr Rckakbvaq,alpha sigma delta sigma alpha zeta delta gamma zeta lambda,6168,598.29,0.976161
2025-09-27,Nnrnyz Swrkbvnj,alpha zeta omega lambda delta delta beta theta gamma beta,3993,973.95,0.126607
2022-03-07,Guvkxr Csvildguz,omega omega beta lambda sigma delta delta theta sigma zeta lambda theta,2848,210.1,0.189097
2023-01-17,Teke Bvlepyyt,sigma lambda omega delta beta zeta alpha zeta lambda beta theta,936,535.6,0.599151
2021-11-16,Kiiwo Eukicic,delta delta gamma sigma lambda delta delta beta sigma theta theta,7936,170.89,0.395365
2024-06-14,Gtkz Ovgsic,delta alpha alpha omega alpha lambda zeta gamma gamma alpha theta theta,8432,500.93,0.132452
2024-12-28,Cdativa Vyryavh,lambda lambda zeta lambda omega,4775,630.08,0.195298
2024-06-24,Ajvmdno Taameiyaq,delta lambda theta delta sigma,6773,496.74,0.582309
2022-12-13,Lbofm Vguhec,beta zeta lambda alpha lambda,8056,97.39,0.775053
2022-01-08,Cgrfart Wwisani,beta lambda beta theta lambda sigma alpha theta,7424,751.55,0.950991
2020-11-14,Ntij Ukiudw,omega alpha gamma delta omega sigma lambda gamma alpha,1578,391.3,0.137122
2022-01-17,Bsutwveb Wwchdai,gamma delta omega omega sigma sigma gamma beta,8848,86.76,0.065934
2021-05-10,Yfrhzwm Vpbhi,beta beta sigma delta theta alpha,9144,985.61,0.606055
2022-09-06,Oeef Ncoek,sigma omega zeta omega zeta gamma sigma beta zeta delta beta,6361,605.06,0.558314
2021-02-10,Qvkwp Rgccyxa,beta delta gamma alpha zeta zeta theta theta sigma zeta zeta,7841,917.13,0.193423
2023-03-19,Dzhetiox Ntoand,gamma beta omega lambda omega omega sigma,6236,482.35,0.780786
2023-10-14,Kwnx Ckdogx,delta delta delta gamma lambda omega theta zeta,8580,673.09,0.745508
2023-03-07,Ajveus Qdpdvdfzk,theta zeta zeta beta zeta theta lambda delta gamma sigma omega,7154,826.31,0.478127
2022-03-31,Xpyaee Oieeyxgip,omega lambda gamma theta gamma delta beta theta sigma zeta alpha,6402,402.77,0.608834
2024-12-18,Tigdfv Qavwagnn,zeta gamma beta omega sigma theta sigma,2685,557.39,0.764684
2023-06-19,Sswcuci Djiixsyfe,alpha zeta beta beta beta alpha zeta lambda omega,8100,693.33,0.926854
2022-02-20,Oarfwfgl Urnigpo,delta theta theta theta lambda theta theta lambda omega gamma sigma,8958,724.72,0.332464
2022-05-29,Lvapeu Gzhznm,sigma omega gamma theta omega zeta,5785,663.01,0.803522
2023-05-09,Ruxpfmjp Tzvlluj,gamma alpha lambda alpha alpha lambda lambda beta beta zeta,8662,456.13,0.164917
2022-11-06,Gsgnustm Aaniyrmx,sigma gamma omega beta theta,5796,732.13,0.861682
2022-06-04,Vfcylvs Nlpcvofv,sigma beta beta omega zeta lambda gamma omega gamma omega delta beta,8814,51.02,0.007204
2024-01-12,Pnhnymg Vzofve,omega gamma theta sigma beta lambda gamma beta beta,4809,524.89,0.6653
2021-06-20,Bxycj Fwoiew,alpha beta theta delta zeta theta delta lambda omega zeta theta,2105,320.02,0.024784
2021-07-13,Nsua Iusepa,beta omega omega lambda delta beta zeta lambda theta zeta delta lambda,3696,229.33,0.610986
2021-03-14,Fdud Nshrtphfh,sigma beta beta delta omega beta omega delta omega delta,541,682.35,0.272033
2024-03-06,Qnfi Gibbx,gamma zeta zeta delta omega beta theta lambda gamma,9164,487.88,0.486677
2021-08-30,Pkqdgcqd Ooxirezg,zeta alpha theta lambda alpha,7202,453.97,0.657883
2025-03-19,Lzqnj Ojsauf,gamma beta alpha alpha zeta omega alpha alpha alpha,4871,287.73,0.989647
2024-06-25,Phzkmrao Dxkfrbwt,sigma zeta theta beta delta gamma alpha theta beta,3042,792.88,0.897402
2022-04-27,Iydlb Pyzozfu,beta delta alpha beta theta lambda omega lambda beta sigma theta delta,4635,14.09,0.332733
2025-01-02,Mrfysm Ryxpst,theta alpha zeta omega beta sigma sigma zeta lambda gamma,8927,213.41,0.810288
2022-09-01,Caqdi Lnmrrwjgv,sigma zeta sigma theta omega gamma,2005,729.38,0.474723
2023-03-17,Bylnb Jlurizne,lambda sigma beta sigma omega theta alpha delta sigma zeta,4744,954.09,0.080547
2025-05-04,Uznlp Rmewrhdox,zeta theta omega beta zeta theta beta lambda,883,351.64,0.510736
2021-05-07,Dadw Wojrpr,omega theta theta omega beta omega omega gamma gamma zeta alpha,4725,270.55,0.893783
2021-11-23,Xjbbxyyj Hiysbzgh,delta zeta alpha gamma beta sigma alpha beta,8243,441.83,0.536522
2024-03-07,Nwkr Dgdbx,beta alpha sigma alpha beta sigma beta alpha sigma omega,9169,166.44,0.811701
2024-09-20,Ixrewb Rjpnsgew,delta zeta omega sigma alpha omega zeta omega beta lambda theta,9863,175.43,0.160226
2025-06-26,Pfpsm Rkjxabkgi,gamma omega theta beta sigma gamma lambda zeta gamma beta lambda delta,298,217.1,0.74561
2021-09-03,Vqfwx Xzboum,beta omega sigma gamma gamma beta lambda alpha delta lambda,3246,840.87,0.67757
2021-08-28,Oamg Lfknlrx,omega theta gamma theta alpha gamma,238,741.37,0.030667
2024-04-28,Mczzapdm Uavtgxjmt,gamma omega alpha gamma omega zeta beta zeta gamma theta lambda,6900,506.01,0.056087
2021-10-16,Cdtemq Qlmhpiww,theta gamma omega beta theta gamma sigma theta lambda delta delta zeta,3827,317.27,0.36989
2025-08-10,Gxdyxop Ezanh,delta gamma alpha sigma theta delta omega lambda sigma alpha sigma,9836,328.19,0.640945
2023-10-07,Pmvtx Ycqjlo,omega zeta omega beta beta theta gamma beta omega zeta alpha,9645,893.05,0.552513
2024-12-20,Ejtheqz Tbjcpbb,theta sigma theta alpha lambda sigma delta,6179,704.46,0.593793
2020-10-31,Wbnb Hzhshb,omega sigma alpha beta sigma delta,9170,713.67,0.781583
2024-02-16,Thyl Fufpyysk,beta sigma omega lambda alpha,2326,267.1,0.721317
2023-07-27,Aesg Mwygntosh,sigma beta sigma lambda omega zeta zeta,2853,302.72,0.871617
2024-07-22,Mxnxm Iznizq,alpha zeta zeta gamma beta delta gamma zeta zeta delta,5566,179.85,0.105668
2023-12-25,Jmnywoi Dssgk,theta zeta theta lambda sigma sigma sigma theta gamma,4212,774.72,0.649729
2025-08-08,Rjpoynip Yzfik,lambda lambda sigma zeta sigma alpha beta omega,3760,915.78,0.253026
2024-12-31,Qdwrm Syvoi,sigma beta lambda lambda alpha,354,612.63,0.938612
