date,name,description,random_sum,random_average,random_decimals
2022-07-01,Hqnj Cqngnhycy,alpha lambda gamma gamma beta omega omega sigma delta beta alpha,9311,504.78,0.566639
2023-04-14,Wwjf Tghhh,omega omega omega sigma zeta theta beta beta sigma lambda lambda alpha,3554,197.57,0.469519
2024-08-09,Jkaer Ysoczh,zeta omega lambda alpha zeta beta gamma omega omega omega gamma,4718,712.13,0.354827
2024-04-28,Gfdpn Ygtty,theta omega omega sigma lambda gamma alpha,1681,44.74,0.227838
2023-12-20,Loti Jsyoqitp,gamma sigma gamma omega alpha theta delta zeta,3169,418.84,0.770781
2025-07-04,Wallsqj Mqmbkl,theta gamma delta alpha theta gamma beta lambda delta sigma omega,882,970.0,0.801398
2023-09-14,Ferychh Dxlcrnscp,lambda theta theta alpha omega,2289,914.67,0.048881
2024-03-24,Nstkgvsq Swvrpojfw,delta gamma sigma lambda lambda zeta,1439,925.62,0.779666
2021-05-12,Kqfqzxot Jlmqiszc,lambda lambda gamma theta zeta sigma delta delta,6720,843.97,0.408661
2024-12-31,Aayv Ecilm,delta alpha theta theta delta,9717,170.4,0.372156
2022-03-27,Uancbw Onsxae,zeta alpha delta omega lambda,1919,414.25,0.682777
2021-05-09,Bzot Osify,delta omega beta lambda omega gamma lambda beta sigma zeta,2111,245.56,0.241431
2025-05-29,Culsl Ijltq,delta omega delta zeta sigma alpha,1519,814.51,0.453857
2024-08-15,Sisvh Gznpui,beta omega theta zeta gamma zeta omega,8805,334.95,0.169101
2022-10-10,Arrwtgt Lplvb,gamma omega lambda theta beta zeta beta omega theta omega omega,461,115.56,0.383464
2021-10-31,Ugkxzhu Rjmyho,theta theta sigma delta zeta gamma delta,7450,905.35,0.679784
2021-11-06,Azcwa Hxbqhkj,sigma alpha theta theta beta sigma zeta sigma,2544,878.57,0.277992
2025-04-29,Hripllzg Fmhpcl,zeta gamma zeta gamma theta alpha sigma delta,1552,826.9,0.483511
2025-08-02,Aogtgg Bgnxz,beta beta gamma lambda sigma,6441,788.89,0.999675
2025-02-16,Sxeaop Umishel,alpha sigma delta zeta beta zeta beta,1745,600.98,0.549276
2023-08-01,Sifb Iwhhs,omega omega zeta sigma zeta omega gamma lambda zeta beta,6226,980.3,0.030002
2024-03-06,Nwxrxr Tupjfjpc,delta beta sigma theta theta zeta zeta delta beta sigma beta zeta,3987,128.29,0.421072
2023-01-03,Bqmtn Nzeccn,beta omega sigma zeta theta lambda sigma,140,95.48,0.367946
2024-09-05,Lulnvpcz Ohgmt,zeta omega gamma beta theta zeta sigma beta,3512,979.71,0.29192
2023-05-25,Miaabmf Jxkshc,alpha gamma sigma sigma lambda gamma delta lambda sigma delta,795,585.18,0.379798
2023-10-10,Sovjovh Jlgtoawy,omega delta lambda zeta gamma gamma omega omega beta gamma,8467,917.89,0.221047
2023-07-29,Zwtnrbp Bahidz,theta sigma zeta delta theta,7493,370.85,0.630605
2024-08-02,Hmgg Riwkv,beta omega theta zeta gamma omega sigma sigma sigma,4456,550.67,0.074803
2021-01-16,Vvckb Ubvpjo,theta sigma omega delta beta sigma gamma zeta alpha alpha delta beta,496,798.53,0.290749
2022-07-26,Osvouyhq Qnetdxjgh,gamma alpha zeta zeta sigma zeta theta alpha theta sigma gamma sigma,4286,701.23,0.983044
2021-03-23,Iayzix Hecsfle,zeta alpha delta gamma sigma gamma sigma gamma delta gamma sigma sigma,1077,841.15,0.644305
2021-11-02,Cekjd Mgyynhhu,beta delta omega omega lambda theta theta delta lambda alpha delta,3337,102.69,0.028028
2021-11-21,Xmpuqjcg Rkieayvtw,omega sigma theta zeta alpha omega beta theta beta lambda sigma zeta,9788,615.83,0.709054
2022-06-17,Gbaq Dpjhsxsqp,beta alpha gamma alpha beta alpha lambda theta beta sigma,7587,943.98,0.344986
2022-10-09,Pgkzxxdp Jtmctr,lambda alpha omega delta omega omega omega beta,4971,908.74,0.469702
2023-09-15,Tsrfjup Qodyzhkcc,delta delta theta lambda beta delta alpha theta,8153,277.36,0.849146
2025-05-27,Fcdlxeu Ttaifz,beta omega omega lambda gamma lambda sigma delta theta lambda omega delta,2547,335.73,0.467897
2021-06-11,Rfacojg Yvzfcnwdz,delta sigma gamma sigma lambda beta lambda beta gamma,5618,767.49,0.128858
2025-08-05,Qpspgw Ugjsse,omega delta zeta delta beta lambda,379,754.73,0.777488
2022-06-17,Dplepdjm Pxbdxrrjd,delta lambda omega delta beta theta delta lambda theta,8040,592.83,0.984252
2021-09-13,Vvyzzxw Euunetgl,beta delta omega gamma lambda gamma,3965,969.92,0.847923
2025-01-29,Rbugqm Ackfktzw,zeta gamma beta omega gamma,8191,480.93,0.286329
2024-01-04,Kklkdt Qqttrmsj,omega sigma beta gamma lambda sigma lambda sigma zeta gamma omega,836,835.87,0.13115
2023-05-22,Tnmgg Rtqeo,omega delta alpha alpha beta sigma beta sigma lambda beta sigma theta,7516,252.4,0.869782
2025-02-08,Ctzesylh Hgnxlaya,omega beta alpha beta zeta theta,4412,911.84,0.452828
2024-11-09,Yatf Jthfsq,zeta gamma omega gamma alpha delta alpha beta omega lambda,1759,703.88,0.994681
2024-08-25,Rmps Jolciwqa,alpha sigma delta delta alpha omega alpha,7806,137.18,0.605169
2023-09-19,Mezp Vuobsrz,alpha zeta alpha zeta delta,4644,964.7,0.471551
2024-10-07,Khfylbu Tnemkwjqh,omega omega theta sigma beta zeta delta alpha,2101,223.93,0.163887
2022-04-26,Waeyjxr Futuvx,beta beta gamma sigma lambda beta theta sigma beta zeta,6761,603.81,0.199526
2023-07-02,Pitxyh Kowdf,alpha sigma theta sigma alpha theta,317,368.45,0.565101
2025-01-31,Zuafkalx Cmqwf,theta lambda gamma beta sigma zeta beta omega sigma omega alpha,934,774.61,0.366558
2024-09-15,Trlfoiq Qhmnok,zeta gamma zeta gamma alpha,1042,475.53,0.052587
2023-09-07,Ryamiou Jkbkf,omega sigma zeta lambda sigma gamma delta zeta theta gamma alpha,7715,992.89,0.90754
2024-12-25,Iooifl Rejoxvxrl,alpha omega gamma zeta beta lambda lambda omega alpha,9809,342.34,0.651672
2023-09-11,Xppjm Ggpkjy,zeta beta gamma zeta omega delta,5400,282.54,0.418282
2024-10-27,Tjggvyf Asquh,alpha theta alpha gamma delta omega zeta sigma,5653,762.21,0.22394
2023-11-25,Pvgzx Tuibava,zeta lambda alpha lambda theta beta beta beta omega theta,4154,663.38,0.564494
2021-05-10,Eciapv Lpasqy,theta zeta sigma gamma omega alpha alpha gamma zeta beta zeta sigma,3762,95.98,0.602104
2024-04-12,Tgqxsnj Zobbevty,delta gamma beta gamma beta beta,4952,730.73,0.331969
2022-05-22,Tgoco Hxrqqpboj,sigma beta lambda omega omega alpha theta zeta zeta alpha beta,1344,958.83,0.531232
2022-04-18,Omncdmz Zifrmie,omega gamma zeta theta zeta,9661,56.65,0.127115
2021-04-27,Nturg Gupzmw,delta theta sigma theta theta omega,4900,440.72,0.659977
2024-10-23,Uszl Bnsabhx,sigma lambda gamma lambda gamma,2358,763.56,0.539346
2025-09-01,Advtzw Pdrtkvqfs,alpha lambda zeta beta alpha sigma gamma sigma,1908,739.71,0.698597
2021-12-11,Ksbkevk Xxnacnpg,sigma zeta beta omega omega delta theta sigma beta lambda sigma,7211,963.36,0.576576
2024-09-08,Wafrkq Amewdvdvi,gamma zeta sigma beta delta alpha delta theta gamma,263,34.09,0.437074
2021-03-23,Znneuth Sqgmy,sigma lambda theta alpha sigma omega sigma delta alpha gamma omega,4009,362.65,0.935128
2022-06-27,Gedjvjr Vscfar,alpha zeta alpha omega delta gamma,800,527.68,0.01005
2024-04-03,Muvqdo Cqcmh,gamma zeta zeta zeta lambda sigma zeta zeta beta delta beta delta,9857,212.31,0.590193
2024-07-20,Lamvs Iqlnkirkn,theta omega theta lambda zeta delta gamma omega zeta alpha,893,779.31,0.928475
2021-01-27,Ejmkbfyk Jwxzfhsr,lambda sigma lambda delta alpha zeta theta lambda gamma,2454,33.89,0.660139
2023-07-06,Oahqsxk Unlbyuv,sigma lambda zeta omega gamma,5851,395.92,0.058979
2024-06-04,Elxdeshx Rzbtsqrbg,zeta omega lambda theta alpha theta gamma alpha theta gamma theta omega,9644,408.17,0.632155
2024-01-14,Xzngozoh Clykrqdk,delta delta omega beta beta alpha omega theta,8367,84.32,0.507667
2024-05-13,Qojm Jninpmh,zeta delta sigma gamma delta,3007,266.86,0.751615
2022-05-17,Gssvx Ypmstkks,beta alpha beta sigma lambda theta gamma theta zeta,7257,663.53,0.303629
2022-11-25,Yxibdap Wtcrmtck,lambda gamma alpha sigma zeta sigma lambda lambda,9214,518.78,0.028957
2022-07-11,Fdqxu Drvjg,delta zeta lambda zeta theta delta,5630,610.52,0.208028
2024-08-08,Eyjxq Lfmgy,omega delta sigma zeta zeta gamma sigma sigma,2365,961.76,0.398868
2021-09-05,Jmnfdssy Cefwcffti,sigma lambda gamma beta omega alpha,6801,464.68,0.208596
2023-05-03,Qqnxj Uziujwi,gamma gamma lambda gamma sigma theta,439,535.08,0.656484
2024-04-12,Jehetsni Ymmkwlpn,gamma sigma alpha alpha delta omega omega lambda sigma beta,9224,804.18,0.716709
2022-02-21,Tfer Ehxuv,alpha gamma delta delta sigma delta theta,5492,805.69,0.430799
2025-05-17,Hsgfttrv Keejgkbk,theta delta alpha beta zeta zeta sigma zeta alpha lambda delta delta,6122,63.22,0.771832
2024-11-09,Xxbha Sfcpuyot,theta sigma lambda lambda theta,3822,934.9,0.463745
2023-09-27,Pxynvpbo Opmfvrv,zeta beta beta zeta alpha lambda alpha theta gamma theta omega,2133,107.0,0.285441
2023-05-17,Gfkhzx Hqxji,beta beta theta lambda theta zeta,2155,47.03,0.5029
2024-02-17,Gjoydzja Ygrbvd,beta gamma zeta beta sigma gamma theta,2602,592.58,0.997186
2021-08-18,Ohuoy Rdghkbf,beta beta delta gamma gamma delta gamma beta,6883,732.22,0.137919
2023-08-01,Rdwcc Mtfkpe,theta beta beta lambda theta lambda lambda,7031,843.51,0.304039
2023-04-20,Mqlzsp Khwwwgdtb,omega zeta sigma alpha delta sigma theta delta theta alpha omega,1529,36.85,0.480023
2025-02-16,Bhqrn Lqanzmkff,gamma sigma beta theta lambda delta zeta lambda sigma delta omega,8362,999.71,0.756292
2021-09-06,Aiobewp Fxipajqz,omega lambda sigma theta delta delta zeta,6391,465.67,0.700828
2021-10-13,Bdqgmmjs Iejgnejj,gamma gamma zeta sigma theta omega sigma theta gamma,6718,14.83,0.392718
2023-09-05,Gxbybrsd Tkhwykktu,theta zeta sigma delta lambda lambda gamma sigma delta zeta,4428,148.2,0.232464
2025-04-13,Crvxgm Tnnuzg,omega zeta omega beta zeta alpha sigma beta omega lambda omega,8259,662.0,0.512462
2022-10-01,Giosbmhe Bxjkn,alpha alpha zeta lambda gamma lambda gamma delta zeta sigma theta gamma,9145,48.18,0.093651
2021-10-31,Ojqd Zwykfbjo,gamma zeta alpha beta lambda theta gamma sigma delta lambda,8076,489.18,0.001692
2023-09-26,Ktpguv Yaimr,gamma beta gamma lambda omega sigma,5004,552.84,0.267575
2022-07-31,Fmkfoq Hcbuqzt,theta sigma sigma gamma sigma,8748,65.71,0.671605
2021-04-05,Tkqeo Hgathddt,lambda gamma theta omega gamma gamma alpha omega lambda lambda alpha theta,6395,356.02,0.702515
2025-03-04,Gbotha Yqpbrp,beta zeta alpha omega sigma alpha delta sigma,5531,996.97,0.699479
2021-01-11,Zsdbnk Gcbdpz,zeta lambda beta omega omega delta alpha zeta omega,3471,336.36,0.707565
2021-09-18,Goskzdu Crlwk,lambda beta beta beta delta delta beta delta,1353,252.47,0.662037
2025-05-04,Mzrjoc Fvsixcgip,zeta beta alpha zeta omega theta omega delta alpha lambda,6207,136.79,0.855533
2024-09-26,Bftf Urhajntn,alpha delta lambda zeta alpha beta delta omega theta alpha,5188,507.76,0.562619
2024-06-02,Wgxjab Rfxarjcq,lambda gamma delta delta lambda gamma sigma gamma,2096,277.68,0.486734
2025-01-08,Wskep Oiazesj,lambda alpha gamma sigma zeta zeta omega alpha,2649,480.58,0.528148
2025-06-13,Rmqfibvf Nwvukst,lambda beta theta alpha sigma zeta omega delta alpha,8173,170.71,0.663067
2024-08-11,Mcjn Zilgu,delta gamma omega beta alpha sigma delta zeta alpha alpha,5737,850.96,0.975291
2025-08-29,Muoy Hfhndifnz,lambda gamma omega theta lambda,7146,280.91,0.011903
2025-06-01,Rfpcb Ruaqz,sigma alpha beta gamma alpha lambda beta lambda theta delta beta omega,6267,722.69,0.088208
2022-11-15,Povjjmy Jmrpl,gamma delta delta gamma omega zeta delta omega zeta sigma theta gamma,5123,886.87,0.481666
2021-09-08,Mueu Dvozjwcxj,gamma lambda gamma sigma beta delta,8837,646.25,0.769235
2021-09-18,Wgegor Awivbgfm,theta delta omega alpha zeta,9868,50.52,0.81998
2023-01-28,Qlfp Bxjqwp,zeta lambda sigma zeta alpha sigma alpha gamma gamma delta theta,4920,41.57,0.598683
2025-01-27,Fzrwfkpn Qxtgxy,delta theta theta theta gamma beta lambda beta sigma theta omega,4008,460.72,0.787367
2022-12-19,Dhrudp Nwmsu,lambda beta lambda sigma gamma lambda zeta delta theta alpha,8718,266.03,0.741582
2023-09-30,Nekq Umymkvcvf,omega sigma omega theta lambda theta delta lambda theta sigma omega,3129,913.63,0.628397
2020-11-05,Mjnm Bnhmy,omega gamma omega beta theta omega lambda beta alpha sigma sigma sigma,517,730.49,0.994899
2024-09-16,Kxmsg Kymzfsu,beta theta theta omega sigma lambda zeta beta omega theta lambda,8542,255.06,0.579088
2025-07-17,Uofnacc Ncshz,beta gamma sigma delta delta omega omega zeta,7286,614.16,0.216236
2024-01-06,Dnopfgac Clblrdm,gamma zeta alpha zeta beta gamma sigma delta omega omega alpha,2721,631.44,0.333613
2024-08-24,Nbxwdh Wtqjq,gamma lambda sigma alpha delta lambda lambda theta omega beta delta,3972,581.15,0.449177
2023-01-25,Jiafwlda Boptzhhxf,beta delta omega omega zeta omega,8658,125.68,0.137874
2023-10-20,Lmhqlv Qvrsktrf,beta zeta zeta gamma zeta theta,4020,959.99,0.814853
2025-09-19,Mcxitl Psipzwq,alpha sigma gamma sigma delta zeta theta delta zeta theta theta,4633,942.79,0.32352
2023-08-16,Hvjcaif Luupga,zeta theta gamma alpha delta gamma theta,259,791.53,0.744984
2024-11-09,Bmctlqzw Ilyjhmcg,beta sigma sigma omega gamma beta,1389,654.4,0.935695
2024-10-01,Uyhe Iceufzy,omega sigma lambda beta zeta theta alpha theta,3588,723.65,0.480857
2020-11-24,Rtvnaupx Egvqxvi,zeta sigma sigma beta lambda theta theta delta sigma,4092,213.78,0.387093
2025-04-24,Tmtpveuq Vcwklxq,delta lambda delta delta theta delta gamma zeta beta sigma omega,4045,819.42,0.449044
2021-09-10,Wfapl Rheey,omega sigma gamma delta delta alpha gamma alpha alpha lambda gamma lambda,2858,827.32,0.033814
2022-06-25,Pbkckzk Edbxdrc,delta lambda beta gamma omega,3983,184.33,0.064402
2024-03-13,Osioqy Qxguqnkp,omega lambda alpha omega gamma zeta beta omega omega,736,615.27,0.602854
2022-07-15,Ewpwam Ynvagh,gamma theta beta lambda alpha beta theta theta sigma omega lambda sigma,3642,868.71,0.263022
2024-03-09,Owegbmeu Zlzlm,beta alpha zeta delta theta alpha,726,960.78,0.447982
2024-06-25,Lviey Ppsxbki,theta sigma theta lambda gamma sigma,5363,561.3,0.16232
2025-04-13,Apdzbpmq Zlfacow,delta lambda gamma theta beta,5947,750.63,0.01559
2021-04-24,Rnmvkxc Krxwcnz,lambda theta alpha alpha omega theta,1507,446.1,0.407269
2023-07-27,Icwy Artuqeaf,omega gamma beta sigma gamma beta lambda alpha theta omega alpha,5311,358.86,0.337283
2022-09-11,Jbgcgxfu Otpgibij,delta beta gamma delta lambda theta omega beta beta,6444,830.52,0.28485
2022-06-02,Mzzi Cunuqkbz,gamma theta sigma sigma alpha lambda theta beta alpha theta lambda,498,905.1,0.103249
2023-06-21,Otigxn Qcgwtpnio,lambda lambda alpha omega sigma alpha sigma sigma theta,4955,668.74,0.673349
2021-11-23,Rwdb Brfkdj,zeta lambda zeta omega gamma delta sigma omega lambda lambda theta,7954,690.7,0.815897
2025-01-03,Lmafzdtt Wigeewnw,omega omega zeta lambda omega omega alpha gamma theta delta beta,2107,338.09,0.86132
2021-03-12,Tiyx Xbcbco,beta alpha gamma beta gamma lambda omega zeta,3121,920.79,0.048984
2023-08-26,Mtmkfglm Egiqxxuv,omega gamma lambda beta beta,8677,231.23,0.426146
2021-08-07,Pkbi Suonfcq,lambda delta beta lambda beta gamma delta beta theta gamma,4851,148.41,0.814104
2021-01-14,Emqiakr Vujzzjhh,zeta delta beta alpha alpha zeta gamma,2784,511.17,0.930977
2025-05-04,Jiwt Zqcvmfibl,theta delta delta beta sigma sigma theta gamma alpha,1784,839.14,0.015837
2021-09-23,Satrqkw Vgyzjxe,zeta gamma delta zeta beta delta sigma,6860,680.29,0.501781
2022-05-15,Vguicuqa Lvdsb,omega sigma beta gamma theta beta theta zeta zeta,2847,648.5,0.151172
2023-04-24,Twxxvgd Lpmpddpjt,gamma beta delta omega gamma alpha theta delta lambda,2928,458.45,0.682565
2022-12-06,Qgcgpacb Vgaqbp,theta alpha sigma sigma omega gamma lambda omega delta gamma lambda,1090,850.79,0.535081
2025-07-10,Ibdosyfp Bleebcp,lambda zeta beta beta delta sigma gamma zeta beta alpha,6437,103.29,0.16062
2021-05-16,Iprgzj Vetmgii,alpha beta gamma sigma gamma alpha delta zeta,6158,420.62,0.832472
2025-03-07,Xronybai Hgnphle,delta gamma theta alpha lambda theta omega lambda beta theta alpha gamma,1026,754.29,0.265546
2023-08-10,Iqofvmt Dwgve,sigma alpha gamma omega theta gamma lambda beta omega theta,8150,380.08,0.501296
2024-05-15,Bfsppd Sjvdflw,theta zeta delta zeta lambda omega gamma gamma sigma,399,300.2,0.197123
2020-12-26,Dtjcuqbv Kogzljj,alpha lambda sigma beta alpha omega delta lambda,8467,504.98,0.311234
2022-08-20,Qaycacz Prjxlm,delta delta beta beta theta,3022,568.24,0.98575
2025-08-06,Hbtevyb Uryam,theta gamma delta theta delta sigma lambda beta zeta,9783,358.45,0.388634
2023-10-25,Bycuys Fdnjrnnla,omega alpha lambda lambda lambda zeta sigma,7601,789.95,0.770781
2023-06-01,Chid Ilkknu,gamma delta gamma zeta lambda gamma omega omega alpha alpha omega alpha,8271,791.63,0.250688
2022-05-08,Zwcn Xwmpe,alpha omega lambda gamma delta zeta,2343,123.99,0.289687
2021-07-14,Uuufhbaq Ivekwwh,delta theta omega gamma gamma,6410,939.4,0.943972
2023-12-24,Tzfx Ajubnjzbr,beta theta lambda gamma sigma zeta,7831,53.02,0.432808
2021-06-14,Vsehhf Unbzcay,theta delta lambda alpha gamma delta omega theta sigma delta,9674,901.01,0.472801
2023-02-02,Rtcevn Agxfmz,alpha beta lambda lambda sigma beta zeta alpha zeta zeta,9609,188.91,0.887782
2024-12-13,Tnskw Apciq,lambda alpha alpha theta theta alpha alpha gamma delta,6930,819.09,0.250617
2023-08-25,Ssed Lmdwog,lambda sigma alpha sigma gamma zeta omega beta sigma omega omega,3098,666.02,0.964728
2024-11-21,Dcqcru Vbkiq,gamma omega theta theta sigma lambda lambda omega delta beta sigma delta,2568,744.82,0.412272
2023-07-17,Juuovay Wrorfax,alpha beta gamma alpha beta beta zeta beta beta beta delta,9345,31.59,0.474831
2023-07-01,Pwhquntt Meowcsc,delta beta omega gamma alpha alpha sigma zeta delta delta gamma alpha,1990,161.39,0.193361
2023-12-13,Uubengbh Vmrfzeltz,alpha alpha alpha sigma omega,7474,882.07,0.698167
2022-11-25,Hhlahsb Glszwglfs,zeta zeta sigma zeta gamma,3264,522.56,0.561161
2022-11-02,Mkyhg Spqoqsom,lambda omega theta beta delta omega zeta alpha sigma alpha sigma delta,2416,936.48,0.268917
2022-12-22,Tjcyi Ojhjnlb,gamma zeta omega gamma sigma gamma lambda omega zeta,6123,806.39,0.165377
2023-10-18,Amihojv Wzlykl,gamma zeta gamma sigma sigma zeta omega sigma beta,3872,800.4,0.940805
2025-05-23,Otno Pjsoanqv,theta zeta lambda theta alpha zeta gamma omega sigma alpha gamma,5336,323.36,0.886679
2020-10-12,Jxas Wtnsnkane,sigma delta zeta delta lambda theta zeta alpha gamma alpha,9526,452.63,0.342153
2025-06-14,Xfas Lnqrry,alpha delta alpha gamma gamma lambda gamma lambda alpha beta,4958,521.69,0.906761
2025-02-24,Rvzdxf Heolylkl,gamma sigma omega zeta zeta beta,1205,662.3,0.785147
2021-08-13,Oiyyl Jjuwze,omega delta sigma omega omega delta omega omega alpha,2164,996.61,0.070224
2021-02-09,Pehrtcxy Ozcfifm,zeta beta zeta theta theta omega lambda,2128,224.28,0.469617
2023-02-12,Jhzts Bhqrv,lambda sigma beta beta omega alpha theta sigma alpha,2191,814.91,0.994863
2023-07-25,Fkqnpy Atagkkm,zeta sigma lambda alpha zeta gamma alpha delta gamma gamma alpha,9607,223.26,0.906968
2024-03-03,Hpzdmy Yoghcfnt,sigma alpha gamma beta beta theta sigma sigma gamma omega zeta alpha,2739,276.94,0.538995
2024-08-12,Qpun Oilysnynx,alpha lambda omega sigma theta zeta lambda omega gamma alpha zeta,7754,352.42,0.449448
2025-09-13,Pchzxhvf Nadag,gamma sigma gamma gamma lambda zeta alpha delta beta delta beta beta,2564,666.03,0.669903
2024-09-21,Fltkxh Vtjyc,lambda delta zeta omega zeta gamma beta,9575,276.42,0.723233
2024-09-08,Esmnjvce Gsamfafwh,lambda sigma sigma lambda omega theta beta lambda omega,7250,386.45,0.51314
2023-02-16,Rxehsbz Wfhibd,gamma delta beta omega beta alpha,204,611.26,0.868871
2021-04-28,Uebhrve Woloicspt,theta omega sigma omega omega delta gamma,6463,723.03,0.967331
2023-08-07,Xirgk Ermtd,omega gamma beta zeta beta lambda omega gamma sigma,4763,812.2,0.275979
2023-09-18,Sfewgfz Ugywj,gamma zeta omega theta lambda sigma gamma lambda,5382,956.38,0.13525
2022-10-09,Tyvqtokb Xeyocosdk,zeta omega gamma alpha sigma,791,334.64,0.09496
2023-01-14,Kbcgklo Axampaplg,lambda theta zeta theta omega,8492,500.63,0.230741
2025-07-15,Damyqrw Irpoluva,sigma zeta alpha zeta alpha alpha delta lambda theta gamma gamma sigma,8403,198.16,0.08606
2021-11-25,Gzudh Piali,theta delta lambda omega lambda,8834,124.52,0.896197
2024-06-27,Qpyi Gmflyxe,lambda sigma zeta omega delta,9477,705.91,0.266772
2023-06-08,Pdvhylxr Fanxw,gamma omega sigma gamma gamma alpha lambda sigma sigma delta theta,3546,279.26,0.394003
2025-04-15,Uydp Qutfry,gamma lambda sigma beta lambda omega lambda gamma,571,25.29,0.320018
2022-03-01,Ycklla Xuffgji,gamma gamma delta zeta delta,8028,264.9,0.148888
2024-09-09,Akocbcbe Udvws,beta delta theta lambda sigma zeta lambda beta sigma,4096,594.03,0.16284
2021-09-15,Gxha Fdefgpjm,lambda theta omega omega delta zeta delta lambda theta,2756,234.5,0.806449
2024-03-16,Vkwkocho Dkogx,delta beta sigma delta sigma,6665,736.15,0.457571
