date,name,description,random_sum,random_average,random_decimals
2022-05-29,Yzdy Txmjzwy,lambda lambda omega beta zeta theta zeta,4879,230.67,0.897202
2025-05-23,Nufabmy Cpkxxnbwh,sigma zeta lambda beta sigma alpha,1989,636.87,0.98028
2025-05-05,Kwojvx Dwpjb,zeta delta delta gamma zeta sigma zeta omega sigma,6622,985.45,0.788047
2021-05-04,Bzrn Jymrymwco,delta zeta sigma gamma theta gamma,4915,195.86,0.978912
2025-04-14,Zmava Dsjmsln,gamma lambda delta lambda sigma sigma,2679,465.39,0.041086
2025-05-10,Cxxbcv Puqffs,omega omega sigma alpha gamma alpha omega sigma gamma beta sigma omega,4804,343.84,0.419871
2021-04-13,Dnbko Xevzk,theta omega gamma sigma alpha omega lambda alpha lambda theta gamma sigma,8352,968.63,0.641259
2021-09-08,Xigodids Aoxndyjpd,sigma delta lambda omega sigma zeta omega zeta alpha omega gamma gamma,2533,410.02,0.727679
2023-11-08,Mqbc Bvkbl,gamma sigma omega delta gamma gamma gamma gamma alpha zeta sigma lambda,6047,495.84,0.175266
2022-09-03,Igpfpcwd Omflcyk,gamma omega gamma beta sigma beta omega omega zeta,6524,736.44,0.771697
2023-09-07,Vikwduxa Yvkckyzi,theta zeta alpha omega gamma,6587,817.78,0.152296
2023-05-05,Lyaxsuqa Phclvpzx,theta lambda theta sigma omega,5950,770.72,0.288495
2022-12-11,Qissizq Vbzuvok,gamma zeta beta alpha gamma sigma zeta alpha beta sigma beta alpha,5177,398.17,0.587421
2022-08-14,Eaxtllh Psfwtkylc,beta zeta omega sigma sigma theta beta omega zeta sigma beta delta,9922,207.68,0.250449
2023-04-12,Tfnzvrfb Vzniavw,alpha theta gamma alpha delta gamma,8961,843.35,0.788871
2022-09-06,Srmfvn Vrxxyd,omega alpha alpha alpha beta,3254,602.38,0.168775
2024-08-07,Kpkt Vhvvkmm,alpha theta delta omega omega lambda theta,5623,113.64,0.105034
2025-05-25,Zcfwyddu Mcocc,lambda lambda omega gamma alpha delta lambda gamma,4921,949.22,0.389275
2020-10-28,Wckj Qhapezfjd,omega gamma theta theta omega beta omega alpha,5872,880.05,0.389456
2022-08-03,Cwqwjlyz Votsy,gamma omega lambda theta alpha lambda sigma beta beta gamma zeta beta,3011,983.74,0.541969
2021-03-22,Ttozsve Vtubm,lambda delta alpha delta zeta,1722,753.51,0.967503
2021-03-05,Fnmcebe Bcjceu,gamma zeta delta alpha alpha beta beta,9153,684.32,0.672623
2025-01-20,Gxlglqq Uqvvhhqs,delta sigma theta omega theta gamma beta alpha,3778,193.38,0.197784
2021-10-26,Redi Jyetb,lambda zeta gamma omega lambda lambda alpha alpha omega sigma,4278,815.36,0.085181
2020-12-20,Rrrlqg Timzja,beta zeta zeta lambda lambda zeta,1087,264.97,0.445397
2023-05-03,Rdykzh Mewtcskay,beta beta theta omega lambda alpha delta gamma,5451,278.84,0.13083
2020-11-14,Uind Brook,alpha alpha alpha theta lambda delta beta theta theta beta theta,8662,256.51,0.871878
2024-07-25,Ghdx Vdcrmq,lambda zeta sigma sigma delta beta lambda,7978,674.67,0.559066
2022-03-12,Lvbunrqk Mcjxrcplg,omega omega theta beta omega gamma zeta lambda delta,664,397.42,0.699879
2023-04-20,Orlsuuo Pihtfxod,alpha gamma lambda alpha zeta gamma lambda delta sigma gamma,5117,118.24,0.043676
2021-01-06,Jfhsmyi Pqeyosuvw,omega zeta zeta alpha sigma delta zeta delta omega lambda,1255,739.08,0.411295
2023-07-22,Ixplqy Brdpd,delta delta zeta beta beta omega zeta,3251,584.17,0.639465
2022-09-28,Jkbzgmxs Rysnv,delta delta delta zeta theta zeta beta gamma zeta delta,8410,383.14,0.919673
2021-03-17,Ozinr Jdblqe,alpha sigma zeta omega alpha sigma alpha omega delta gamma,7462,264.51,0.340799
2024-05-24,Swjokuo Adjmir,lambda gamma gamma omega sigma zeta sigma theta lambda sigma,3662,776.94,0.662393
2025-07-26,Xmkckc Jslyqh,delta omega theta theta zeta beta,9875,124.16,0.520254
2022-07-27,Wnmv Vcofcnh,gamma omega delta beta beta sigma,8152,727.83,0.605174
2021-08-15,Abidbm Bmdneh,beta alpha delta beta zeta omega,9846,213.97,0.382834
2021-01-14,Lxhg Acovngevg,theta theta gamma omega delta delta sigma omega omega,4365,340.25,0.885067
2023-03-20,Zhqrdk Rdeja,alpha beta omega gamma alpha zeta sigma lambda delta,2875,490.4,0.916012
2022-02-13,Jjkwg Ufkhli,gamma lambda alpha beta beta sigma gamma alpha delta theta omega omega,5511,920.51,0.93827
2020-11-17,Qpei Exedyh,zeta gamma delta gamma zeta theta omega beta sigma sigma theta,4171,146.22,0.421793
2024-09-08,Xoklhq Gjnocm,sigma zeta theta delta gamma zeta,5554,230.89,0.68718
2024-03-11,Iayvvv Jhldp,sigma alpha delta theta omega sigma lambda omega,1194,995.83,0.059189
2023-01-11,Cppennlq Ynaptgb,sigma omega theta gamma zeta beta zeta theta beta theta delta,1554,140.7,0.643257
2023-11-15,Gdqra Zynbhf,zeta zeta omega theta zeta gamma lambda alpha omega,1779,842.03,0.373322
2021-08-06,Cypjg Sgiatibe,omega theta beta sigma omega gamma delta lambda beta omega sigma,2127,702.25,0.177496
2021-08-03,Eokpgfj Iivuc,beta theta delta theta gamma sigma zeta,5262,995.11,0.239233
2023-07-07,Dffydzxt Avcfy,gamma delta omega theta sigma theta beta delta gamma,5632,611.94,0.368208
2025-04-29,Snnzetv Fhqiac,alpha theta zeta alpha gamma lambda omega alpha,8819,707.31,0.960199
2023-05-29,Uppxqrx Tndfk,sigma theta theta zeta zeta,7418,107.59,0.695766
2021-10-26,Zujwov Zuqtz,beta zeta theta gamma delta alpha lambda lambda theta lambda omega,2203,828.46,0.445534
2021-08-05,Negurkoz Smtnaxx,sigma sigma lambda alpha beta delta theta,7229,717.06,0.843264
2021-01-24,Lxnhu Vfqaf,lambda sigma beta alpha lambda theta delta delta,384,828.24,0.715241
2023-02-06,Fxeemgr Ncgmzih,delta gamma theta beta gamma gamma lambda,8936,982.97,0.318204
2023-11-27,Zmkjzrui Bfduhl,beta lambda lambda sigma theta alpha alpha lambda omega alpha alpha alpha,937,521.83,0.359745
2023-09-17,Ablappki Rhktrnnk,omega lambda gamma alpha omega omega gamma zeta,1580,929.91,0.303399
2023-08-29,Veyrpxtm Zphmkeslq,gamma lambda omega theta beta sigma delta delta,3925,245.08,0.972941
2025-07-22,Speej Jfoyo,gamma lambda lambda lambda zeta alpha lambda beta,8362,689.81,0.140525
2025-09-28,Vrau Mdysk,lambda beta theta lambda gamma omega sigma gamma gamma sigma,7132,172.97,0.134036
2022-11-17,Kutlrb Lgdktaf,omega zeta lambda sigma alpha zeta beta theta lambda,7521,612.22,0.187988
2024-12-21,Hogfdr Eoqazrwhl,gamma delta theta omega lambda theta alpha delta,2637,319.71,0.947838
2025-02-07,Cjxzzxi Yqsza,theta alpha theta lambda beta delta beta omega theta,393,536.16,0.54363
2023-10-05,Eavsbea Oyymrzl,zeta zeta gamma lambda beta delta lambda,6900,347.62,0.970182
2021-02-24,Hwbcfw Vgognulo,lambda beta omega alpha zeta theta lambda delta omega omega gamma delta,7723,111.37,0.905046
2023-04-28,Ymiek Sefeyac,sigma zeta theta alpha beta beta alpha gamma omega,8917,182.85,0.88267
2025-10-02,Sflpvdt Nylqyo,beta sigma beta sigma delta omega,5369,486.86,0.362715
2021-06-04,Cnltjat Eckcig,lambda lambda delta gamma zeta lambda beta theta gamma,8047,426.66,0.529179
2021-11-17,Yhqirnxr Iqgfu,theta zeta theta theta lambda lambda omega alpha,5704,589.85,0.469751
2024-03-26,Hwkddcu Fjdzkc,omega delta beta omega beta gamma gamma alpha beta lambda lambda delta,7028,169.55,0.961296
2024-07-30,Ztjrds Ecddu,zeta beta delta gamma gamma beta gamma omega alpha omega,7361,342.96,0.326435
2021-12-23,Eguwtcpy Izsxvpmm,lambda zeta alpha sigma gamma omega gamma alpha delta alpha,9153,154.66,0.784319
2024-03-31,Imsopmzx Xmxelyu,gamma lambda beta alpha lambda zeta alpha zeta lambda,8726,278.82,0.005444
2023-06-24,Wseeww Eesrm,delta gamma alpha beta zeta omega lambda,9186,731.23,0.854151
2021-07-28,Hpno Svmlu,beta delta zeta gamma alpha beta theta delta omega,934,771.62,0.744972
2021-01-17,Ixfo Hcaxsyoaw,alpha delta beta alpha lambda lambda,4856,410.46,0.027344
2024-12-12,Ekmpkzos Rqxrhn,lambda lambda lambda omega theta lambda delta zeta lambda omega omega alpha,6561,48.65,0.37556
2025-09-15,Dxrd Xmvcrdmw,alpha theta sigma lambda zeta,3192,915.31,0.626371
2024-06-13,Vsle Dtfnkrk,beta omega alpha lambda omega,9577,210.38,0.36449
2022-09-28,Rqodgbuh Atmaw,omega lambda lambda omega sigma gamma,5451,986.4,0.985908
2024-09-09,Ouokmsqb Eyoatlfq,omega delta sigma sigma zeta gamma delta theta zeta,2018,66.75,0.423531
2021-01-10,Fxva Hbogzshl,theta delta delta gamma gamma gamma,8856,917.33,0.558474
2022-05-31,Zmaor Rnooc,sigma lambda omega alpha lambda alpha theta omega omega omega,5369,746.01,0.405751
2021-05-14,Edqbigx Czrppi,zeta theta sigma zeta gamma delta,7100,183.68,0.465948
2023-04-03,Oodarps Nwfyqzjil,theta delta delta omega theta omega beta,3629,257.24,0.735703
2021-01-06,Drdlgbl Vqwqvwnhu,lambda lambda zeta zeta lambda beta theta delta theta delta delta zeta,6976,952.23,0.433497
2023-02-03,Qmsje Musam,sigma alpha alpha omega alpha alpha zeta zeta beta delta,9897,443.2,0.81563
2021-03-05,Jsaavfz Ytbtx,beta delta theta sigma gamma lambda gamma delta zeta,5522,34.29,0.893367
2021-11-23,Htxvc Xjgubnqbv,omega omega lambda theta theta gamma sigma lambda zeta beta zeta,2291,95.44,0.236815
2022-12-10,Wcvz Traigt,alpha beta alpha zeta alpha theta delta lambda omega alpha,9980,867.24,0.974252
2025-06-25,Svsjd Uwfkiiaz,theta zeta gamma lambda omega lambda omega,4955,102.22,0.934612
2023-03-02,Frbbuwn Pluilf,alpha alpha beta gamma theta omega gamma zeta gamma beta alpha,4122,672.78,0.033195
2024-11-14,Hphebn Vebqul,alpha delta theta lambda theta theta delta,3691,902.34,0.66759
2025-01-30,Wqaq Ibxpkppyn,delta omega lambda zeta delta beta beta lambda lambda gamma delta lambda,2420,644.9,0.811534
2022-10-13,Xmqupr Dpttttf,theta delta delta delta gamma sigma,5175,57.05,0.968198
2021-05-03,Adyltj Zyjgjx,lambda beta sigma omega sigma beta omega lambda alpha,4980,971.58,0.024421
2023-10-05,Vtam Fyjzvi,zeta alpha theta zeta alpha gamma theta theta,1152,819.83,0.256909
2023-03-27,Uvrigdsa Gjzhjj,sigma alpha lambda zeta omega,5903,603.55,0.46642
2024-11-28,Njstbwfw Umdgltg,omega alpha delta alpha zeta lambda sigma,1638,570.5,0.059971
2022-03-01,Tvsny Etgjs,alpha alpha lambda zeta delta zeta alpha theta beta lambda,9428,57.89,0.692183
2023-12-08,Xgtgshvf Cgkfr,sigma beta gamma zeta theta sigma,9428,269.08,0.412571
2024-03-26,Brxpjrk Dispv,gamma theta omega alpha alpha alpha omega lambda omega beta alpha zeta,5072,77.23,0.785689
2022-11-10,Askrucy Wdtxt,zeta delta delta omega gamma,1569,285.75,0.177444
2025-06-01,Iwxhz Pumbar,gamma delta theta gamma sigma gamma theta sigma gamma,6985,639.57,0.913969
2025-04-18,Qirllibf Uzwxwyggu,beta zeta theta sigma theta omega delta delta beta delta omega lambda,526,337.19,0.265428
2025-05-28,Jccdhf Ymnzoxh,sigma zeta omega alpha sigma gamma alpha delta zeta sigma lambda gamma,4334,797.18,0.675902
2021-01-16,Xgpsb Gavuiz,sigma lambda lambda zeta omega,3942,426.44,0.446506
2021-01-02,Houchq Okxwrhh,beta alpha delta lambda gamma delta gamma sigma theta,4043,674.19,0.569313
2020-10-28,Dljpw Dkonpxqt,sigma beta sigma zeta gamma gamma lambda gamma,8763,235.13,0.72241
2025-05-27,Foasbu Qnsyty,delta beta zeta theta delta lambda beta zeta alpha beta beta gamma,3153,872.64,0.371049
2021-02-21,Pzbz Egouye,zeta alpha theta lambda theta alpha,2076,69.46,0.1972
2023-03-03,Kbxeqa Fdlogbkcq,delta sigma lambda beta sigma alpha,2406,296.03,0.40507
2025-02-04,Pswr Dcnotwvt,theta theta lambda gamma sigma theta lambda,9893,637.59,0.149638
2022-03-14,Xvhlja Fwdeg,omega omega beta sigma omega beta omega,8381,229.44,0.171905
2023-02-09,Mkmoz Dlmyamgtb,gamma alpha theta beta beta beta lambda omega,7340,916.81,0.861087
2023-03-05,Jesvxhj Zcohfmj,beta zeta lambda omega lambda sigma,8724,916.43,0.039691
2022-03-12,Isulzjf Tunnpnckp,theta alpha delta omega gamma lambda omega beta sigma omega zeta,3643,305.66,0.392238
2025-05-14,Cuuztyk Bzyqvk,gamma alpha beta alpha theta,817,594.67,0.546897
2022-04-28,Bresgjxc Bsgpfoae,omega gamma omega beta lambda delta gamma omega omega gamma omega,9034,74.79,0.75434
2022-09-30,Alwkh Nbebkqe,sigma theta omega lambda beta beta beta,6531,982.86,0.392245
2025-03-10,Hijnkjok Mircyam,sigma lambda zeta omega beta omega theta gamma alpha lambda zeta sigma,8731,130.69,0.839539
2025-01-06,Pijlcbq Qjxkcwm,delta delta theta beta delta gamma sigma gamma,9231,772.14,0.030608
2025-03-25,Rqurjly Cizkoqncv,theta beta theta zeta delta beta theta gamma zeta gamma,2042,543.08,0.268213
2022-06-08,Cprgx Zuvqrz,omega omega lambda lambda beta alpha lambda delta,6590,957.53,0.594519
2023-01-08,Pdfxsyo Forchnfg,lambda gamma theta theta gamma alpha delta theta gamma sigma zeta,3526,735.76,0.321013
2023-01-08,Qjenids Vsxfk,sigma theta zeta sigma delta lambda delta theta zeta sigma alpha delta,9416,623.86,0.544676
2024-01-25,Rrbnvuc Seqel,zeta alpha delta alpha lambda zeta theta lambda sigma,7984,80.08,0.272026
2024-03-22,Zrmyi Glmppa,alpha lambda delta alpha lambda zeta theta beta beta alpha,6022,544.29,0.361269
2020-11-26,Ltld Hydzkyp,alpha lambda sigma lambda alpha gamma zeta theta omega lambda beta,4473,856.82,0.733249
2020-10-07,Wzoagq Jumhsox,alpha sigma sigma delta lambda theta,8104,446.83,0.703151
2022-06-25,Vbvr Onqjdsy,omega beta delta lambda alpha,3965,681.81,0.493218
2025-09-17,Zulcnlt Hngeapu,zeta zeta gamma gamma beta lambda alpha delta,1025,195.81,0.505252
2025-07-24,Qkzluimq Clyvc,beta lambda sigma beta zeta zeta zeta lambda omega sigma lambda,5004,260.49,0.202812
2024-01-15,Wzwxgngr Bwuqkxyuq,sigma alpha theta delta theta gamma sigma,5828,659.1,0.973991
2021-09-22,Jlapr Ffyyn,alpha lambda beta omega omega,7944,105.77,0.330968
2020-11-28,Eusbc Qoxxwv,theta theta theta theta beta sigma theta sigma beta lambda beta theta,9849,851.5,0.374268
2024-05-07,Srjykk Qjyhb,theta theta sigma beta alpha alpha beta sigma theta,3491,297.27,0.494753
2021-06-08,Lxde Vgkpvwqws,alpha alpha theta sigma delta zeta sigma omega lambda,9699,932.44,0.554168
2020-10-11,Twtxvs Afcnta,alpha gamma sigma delta theta beta zeta beta sigma omega theta beta,1743,728.35,0.872057
2023-03-13,Hxqy Sdppp,sigma delta omega zeta sigma delta beta delta omega omega,9500,232.13,0.095843
2024-02-06,Pfwt Jmzqy,zeta lambda lambda delta omega omega zeta beta theta alpha lambda,1437,779.15,0.146598
2020-11-13,Vbujhkd Rwxtiyzx,sigma alpha gamma sigma zeta alpha omega gamma,8528,305.93,0.054421
2023-03-24,Rieworwf Igcxjd,omega gamma alpha theta gamma omega,1536,905.19,0.481361
2021-10-17,Yehdeuzo Qsoqaifi,beta gamma gamma delta omega theta zeta beta,5637,773.27,0.947162
2022-07-15,Nzxbgzpr Dwhvm,lambda omega omega omega alpha theta zeta delta lambda gamma beta beta,9407,49.7,0.932349
2024-08-01,Xpdgtlw Gwpiqh,theta theta theta beta theta alpha zeta sigma delta beta alpha,6411,90.36,0.262487
2023-08-23,Sucngbs Ycvzmfgf,delta beta alpha gamma beta delta lambda,3905,962.71,0.562989
2023-06-05,Wmvt Ogshw,gamma delta delta gamma delta gamma lambda,9799,608.95,0.28297
2021-01-04,Eulurpbj Uwlrgywjy,lambda delta omega zeta sigma,1253,913.69,0.940956
2021-06-24,Iylora Yvuwcpw,lambda sigma omega alpha sigma theta omega lambda theta theta zeta delta,3950,732.58,0.209697
2023-08-24,Upjgkw Guwxkqx,beta beta gamma theta omega beta lambda omega alpha delta zeta,9835,381.23,0.196382
2022-12-04,Aqbyz Tdisuyhka,delta gamma alpha theta theta beta gamma theta gamma delta,8237,342.41,0.340983
2022-09-20,Pytateul Zghkpse,theta sigma alpha beta alpha theta alpha,1734,368.63,0.015515
2020-11-25,Shdv Uypmsri,gamma zeta delta delta delta,8412,662.5,0.191709
2025-04-09,Weypdi Wfmtksutf,beta beta delta omega theta gamma zeta theta omega delta,5571,251.5,0.082223
2022-10-28,Jtnwe Etpbv,omega theta beta gamma omega alpha theta,6573,455.63,0.827306
2025-05-03,Qljaeq Wtceimb,sigma zeta omega omega zeta theta delta,6993,333.7,0.583775
2024-10-21,Bftbmxy Govgzhb,lambda delta beta alpha delta theta gamma zeta alpha sigma zeta,1300,84.35,0.545831
2022-01-11,Iffuwp Ogceafmgn,beta lambda lambda gamma theta delta sigma theta theta,7934,516.82,0.65515
2024-01-20,Feubdswm Uknzcxd,omega lambda gamma sigma zeta zeta,5760,91.99,0.109018
2024-06-29,Dshcborv Kszlhrc,delta omega gamma omega lambda sigma omega zeta zeta beta,1161,569.34,0.217379
2022-09-18,Yibbzn Zafysbmw,lambda zeta delta delta delta zeta,9921,28.8,0.161024
2023-03-13,Kopaykfe Vzgibbusl,beta zeta gamma theta omega,3552,787.98,0.005943
2024-07-08,Fphgqimp Xhdqwvqn,delta sigma zeta sigma beta gamma beta alpha gamma sigma delta,7551,117.24,0.980971
2022-12-22,Hbcadrf Inzrs,omega theta theta delta delta beta sigma beta zeta,9546,228.03,0.514188
2022-07-26,Dndncr Qvybbqt,lambda alpha theta gamma beta alpha sigma delta sigma zeta sigma sigma,8792,700.73,0.303622
2021-10-08,Byvcrmv Kfnzctzgj,beta theta alpha omega delta lambda gamma theta alpha delta,8693,321.25,0.402243
2024-05-29,Lxub Qxvhkaqg,delta alpha omega theta sigma beta gamma omega lambda alpha omega zeta,2263,500.86,0.520542
2024-02-24,Tlph Ftgkve,alpha beta theta lambda beta gamma gamma sigma gamma gamma,3173,375.68,0.747143
2024-06-15,Bsjvjxrx Mofon,delta sigma lambda alpha gamma lambda delta,9510,981.55,0.803546
2025-01-26,Fkpy Aybgv,zeta sigma sigma gamma theta gamma delta omega lambda,2682,626.16,0.389359
2024-02-24,Unynwut Wlefjbpmd,lambda lambda zeta lambda zeta,3617,603.7,0.091681
2020-10-21,Kzzziia Ualoy,omega lambda zeta beta gamma alpha alpha alpha sigma delta omega,1864,929.69,0.500516
2023-06-11,Soyy Njltvn,zeta delta sigma delta omega,1668,186.21,0.686194
2022-08-18,Vkcyd Idgbzfcz,theta sigma gamma gamma sigma theta delta omega delta,8518,735.06,0.22031
2022-02-12,Wmqjl Cyyklsfr,sigma alpha theta beta theta delta lambda gamma gamma,853,749.92,0.069548
2022-08-16,Amqlj Ftkfyrlo,zeta zeta theta delta beta delta lambda zeta lambda theta,9918,496.73,0.688842
2023-07-10,Bujlgmt Knloewmzr,zeta gamma delta delta omega zeta delta delta,4064,784.19,0.056508
2024-06-14,Xjxyy Fdgdtry,sigma beta omega alpha omega sigma omega,9033,276.32,0.237519
2022-10-06,Lbxch Onrgzk,alpha zeta gamma omega sigma beta,9850,837.47,0.574666
2021-09-12,Xyahk Bvavux,beta theta alpha lambda theta,7448,390.71,0.408948
2024-12-29,Jdlyh Wbgpw,omega beta zeta lambda delta omega,9793,658.16,0.407736
2024-03-09,Cjxbxf Ooywirqn,alpha sigma omega beta omega omega gamma beta zeta beta,8592,521.95,0.420612
2023-08-07,Soexwg Mcgztdud,theta beta gamma zeta theta omega,8348,891.12,0.149362
2023-01-13,Pcrcbgo Gcwoxzxo,omega alpha lambda gamma lambda lambda zeta,2777,114.44,0.623292
2021-12-13,Jenla Dplyni,zeta lambda beta theta alpha gamma omega zeta,4124,542.17,0.461523
2024-11-15,Exma Kzaylrjvy,delta beta beta alpha lambda omega beta sigma,7515,771.19,0.974777
2024-09-04,Szjji Agcbggwvh,alpha lambda theta alpha zeta omega alpha delta alpha zeta zeta gamma,1949,639.75,0.769255
2021-12-06,Uhcmrk Yovuh,alpha omega beta theta gamma gamma zeta beta lambda zeta sigma sigma,2350,120.26,0.051111
2024-02-17,Uhltwqqn Tfvkvzsus,theta delta zeta alpha theta,3627,108.58,0.318407
2021-01-29,Hfbz Hcknbfxo,beta theta delta theta theta,2758,469.14,0.937152
2024-10-27,Oyrfmq Mptkpygq,alpha delta gamma beta omega gamma alpha,6088,894.65,0.160632
2023-09-03,Qddu Desrb,theta lambda beta theta alpha gamma gamma,4190,194.3,0.055322
2023-07-07,Zbtqi Bkejkq,lambda delta beta lambda lambda,9824,633.52,0.618927
2025-06-30,Kyacl Vjxloyxe,delta zeta zeta omega sigma beta omega omega zeta omega zeta,5369,174.43,0.108167
2024-07-25,Osjw Irprbl,alpha lambda delta alpha gamma theta theta alpha zeta sigma lambda,9463,440.22,0.547034
2022-06-29,Ooed Ukwczx,alpha gamma alpha gamma delta theta sigma sigma alpha beta delta omega,6160,285.8,0.994732
2023-03-16,Tmexmqtk Shcuyh,sigma lambda zeta sigma delta lambda gamma zeta delta omega,9376,966.21,0.948902
2025-08-25,Lbkaeue Idqpybk,omega beta gamma sigma theta lambda sigma omega beta,5939,794.71,0.360372
2024-05-27,Usfdzn Fdztzyqst,delta zeta omega sigma beta sigma lambda,3109,87.66,0.134307
2021-07-09,Jyguenyo Usovmx,delta delta beta lambda omega alpha,2091,264.22,0.209029
2021-10-26,Sobzni Ciraot,theta alpha alpha lambda zeta alpha sigma sigma alpha omega,9448,330.86,0.657912
2024-02-17,Lcibnrc Xfxfez,theta beta sigma theta lambda theta alpha zeta lambda alpha omega delta,2010,947.27,0.10646
2024-09-17,Zrrxe Qxpxay,beta sigma theta alpha beta alpha,7577,274.62,0.686731
2021-07-31,Equgsw Dpxyhlfzo,gamma theta gamma omega delta omega theta lambda zeta theta gamma,5211,968.3,0.816001
2020-11-03,Mydqzw Jirunwue,theta beta zeta beta delta,3770,909.96,0.576383
2025-02-17,Xymvptyq Gthddy,sigma lambda alpha sigma delta lambda sigma omega beta gamma lambda gamma,3175,472.35,0.096593
2025-09-11,Btlckqj Dwljyl,omega lambda omega sigma beta delta sigma theta delta sigma,1929,981.42,0.477562
2022-02-07,Ftixfn Gvdiiwjk,beta alpha zeta delta zeta delta delta alpha theta theta delta,1559,466.3,0.989088
2025-04-21,Vdfvb Wzrfbnerr,beta zeta sigma gamma sigma theta lambda beta delta,4084,841.01,0.706855
2021-02-10,Romnnzs Hojrctwu,lambda beta theta sigma beta alpha theta delta,7657,242.97,0.373989
2022-10-25,Rtyzqrx Zleoiuzcw,beta omega sigma sigma delta gamma lambda omega beta,876,55.41,0.470401
2021-06-29,Cwio Mexdf,theta sigma gamma delta theta gamma gamma omega beta,8674,595.9,0.856263
2021-03-07,Nmphj Jkesbvyn,zeta gamma alpha omega zeta omega gamma,9222,149.04,0.910483
2020-12-08,Bgtoagvu Jplgjcwk,omega theta omega gamma theta beta,3226,721.24,0.96869
2021-06-18,Usmf Lmwxbuxi,beta beta omega beta lambda sigma beta beta sigma gamma,2959,750.57,0.607934
2024-11-05,Tlatsz Tgbmurzw,delta sigma lambda beta lambda delta delta theta,7378,84.16,0.353728
2021-08-03,Hijtyieo Jmonihgp,zeta alpha delta zeta sigma omega lambda gamma gamma gamma sigma,9491,495.3,0.44467
2025-07-27,Feubco Xjeimxk,beta delta gamma alpha lambda delta lambda sigma zeta,588,649.63,0.892352
2021-02-25,Mnimmp Uxgzv,gamma alpha alpha theta beta zeta,5890,140.09,0.057493
2022-06-22,Vyqkim Xteps,zeta delta lambda omega sigma beta alpha sigma delta omega gamma alpha,2450,419.74,0.689306
2021-04-14,Jmzzpq Jgthecxi,lambda theta gamma sigma alpha beta delta gamma gamma beta,6870,823.57,0.69021
2024-05-27,Efzei Czlapp,theta gamma beta sigma zeta omega zeta alpha gamma,4019,577.35,0.013253
2023-08-01,Cqmaw Lrartazex,beta gamma alpha sigma omega delta beta alpha lambda delta theta lambda,3780,265.63,0.054965
2021-01-31,Xqzduvcx Octucapca,beta zeta theta zeta zeta alpha gamma,1360,404.21,0.901499
2023-09-01,Rttnp Ljcrczvv,beta lambda delta alpha lambda delta delta theta,9063,231.61,0.68009
2024-10-03,Fttifk Qcbiihgo,theta lambda zeta delta zeta omega gamma beta delta lambda sigma omega,6823,875.16,0.615148
2024-12-24,Npxu Rcxat,delta theta zeta zeta zeta gamma,7312,823.35,0.140143
2025-02-21,Kwkjad Tajprb,beta theta delta zeta lambda sigma gamma,9083,133.57,0.13307
2024-07-04,Ktcj Zverqrwrq,omega zeta alpha zeta sigma alpha zeta zeta,7532,872.84,0.449173
2024-06-17,Mrgfthzo Rutgvy,omega beta zeta sigma delta beta delta delta omega gamma theta omega,9204,487.04,0.612107
2023-02-08,Nytj Clppr,alpha gamma gamma gamma lambda delta theta,1621,481.21,0.615146
2023-04-01,Pmtqzo Vjfsywy,alpha zeta theta zeta zeta theta gamma lambda alpha sigma delta lambda,5116,399.02,0.735628
2022-03-03,Hggv Vhucwu,theta sigma alpha sigma delta alpha theta theta omega lambda gamma,4537,870.22,0.883602
2022-09-09,Clpr Tujiw,delta omega lambda sigma alpha zeta alpha,9111,647.92,0.217747
2023-01-07,Gkctklr Ftrndhy,beta gamma omega omega lambda zeta alpha delta,3141,784.48,0.27366
2025-01-06,Nkrnmw Kftwfiwlt,beta sigma zeta gamma beta omega,7849,340.43,0.647906
2020-11-05,Gwwicwto Dqsawirfj,sigma delta sigma delta sigma lambda theta theta,7198,654.15,0.643951
2022-08-12,Gqntnug Upralqa,lambda theta omega delta omega,2641,67.85,0.277719
2022-01-22,Hvpu Wjpawd,zeta delta beta omega alpha gamma beta gamma,839,185.26,0.826566
2022-07-21,Ulyw Xymibpzf,gamma omega lambda delta alpha alpha omega beta gamma alpha zeta,4479,360.35,0.477013
2023-04-07,Yqxfssa Twzrydjlv,alpha omega sigma omega omega omega,2910,762.48,0.15108
2023-02-18,Znuqum Nmtgu,omega alpha gamma sigma alpha gamma alpha omega delta lambda alpha,917,134.21,0.865533
2024-09-23,Jknhltt Akxmbdda,zeta zeta omega sigma delta delta delta lambda gamma lambda sigma,7421,212.14,0.698157
2023-06-01,Xmhoyo Jsjmrfry,theta theta beta beta zeta,8981,505.07,0.945784
2023-02-02,Vexffsr Imberhkr,lambda omega alpha sigma beta omega beta omega beta,1841,31.67,0.805922
2024-02-14,Bhbw Cnmca,omega lambda beta alpha beta gamma lambda,5093,978.1,0.487823
2023-10-25,Uadsz Ekipv,zeta omega lambda lambda beta zeta sigma lambda gamma,931,537.86,0.108275
2021-12-21,Btumk Atvemgu,theta beta delta delta sigma gamma lambda omega zeta,3657,342.85,0.626316
2023-01-04,Bdxsnyt Gnkifl,omega delta zeta gamma zeta zeta sigma lambda lambda delta zeta lambda,4942,207.92,0.809483
2024-07-26,Yqjifx Umcjyidz,omega delta lambda sigma sigma alpha sigma,7461,32.52,0.923851
2024-10-03,Erkmtlol Oxmmkpl,omega theta lambda gamma theta gamma,8796,181.15,0.875065
2020-10-17,Fgxeoxxk Qazxufn,omega theta lambda sigma zeta alpha alpha alpha zeta delta omega,291,795.94,0.544249
2022-11-02,Tzro Jcwyt,zeta lambda zeta gamma gamma gamma beta,8698,684.57,0.639392
2025-05-24,Mfkwwttr Gzprtaxjq,sigma beta zeta theta lambda beta lambda omega beta zeta,3219,409.52,0.730725
2021-09-15,Ccoyhbxj Hvwnzrbg,zeta theta sigma gamma zeta delta lambda beta beta,1757,15.19,0.411528
2024-02-23,Nmcbj Gfefm,lambda theta theta alpha lambda delta gamma lambda sigma,7675,140.7,0.466939
2023-07-01,Ujda Fypjby,gamma theta sigma omega beta,8375,148.88,0.184493
2021-02-05,Yeovl Udtqqcf,theta gamma alpha gamma beta delta lambda gamma gamma,207,287.55,0.074116
2020-10-22,Ogfpp Pmzlfxr,theta alpha omega gamma delta gamma,5036,390.42,0.167544
2022-06-02,Ykrm Dtavgtz,zeta sigma zeta omega gamma sigma theta theta,5585,423.3,0.182572
2022-08-18,Usgvptac Fkqjpys,gamma zeta sigma beta theta alpha lambda omega lambda delta beta,4895,219.84,0.248012
2023-09-08,Toiqqz Iruelfczi,sigma gamma sigma gamma alpha theta omega gamma,2094,461.47,0.192443
2025-01-04,Lkpptb Asdwuto,beta gamma delta lambda sigma zeta sigma,3708,358.03,0.319582
